rpt_title,menu_id,standard,select_scr,query,form_name,summaryflg,workareas,globl_vars,messagelin,comment,entered_by,lupdate
"Returns by Title","Sales Reports",T,"TITLESEL.SPR","SELECT ;||        title_id, ;||        title, ;||        ISBN, ;||        SUM(order_qty) AS order_qty, ;||        SUM(order_amt) AS order_amt, ;||        SUM(paid_qty) AS paid_qty, ;||        SUM(paid_amt) AS paid_amt ;||  FROM <<Report Title: Title Sale","SALESUMMARY.FRX",F,5,"","Reports the titles returned.  Similar to Sales by Title, but limited to returns.","See comments for "Receipts by Title" report.","***",1/2/2010
"Royalty Account History","Report Payables",T,"PAYABLES.SPR","SELECT ldgrtran.*, ;||	PADR(get_cust_po(order_key), 12) AS cust_po_no, ;||	PADR(getinvoice(order_key), 13) AS invoicestr, ;|| 	PADR(getrcptdet(receipt_no),40) AS rcptdetail, ;||	000.00 + get_rate(trans_type, spec_no) AS rate, ;||	contact.company, ;||	con","RSTATMNT.FRX",F,4,"","Generates a Royalty Statement based on the authors account history.","This procedure depends on the fact that a blank record (i.e. SPEC_NO = 0) exists for joining royalty rate data with ledger transactions.","***",9/10/1997
"Royalty Contract Specifics","Report Payables",T,"AUTHORSE.SPR","SELECT ryltyspc.*,  ;||	title.title ;|| FROM ryltyspc, title ;|| WHERE UPPER(ryltyspc.title_id) == UPPER(title.title_id) ;||   	AND author_no != 0 ;|| 	<<select_str>> ;|| ORDER BY author_no, title.title_id, threshold, discount;|| INTO CURSOR ryltyspec","RYLTYSPC.FRX",F,5,"","","","***",9/10/1997
"Royalty Sales","Report Payables",T,"AUTHORSE.SPR","	SELECT 	ryltyspc.author_no, ;||			contact.company, ;||			contact.last_name, ;||			contact.first_name, ;||			title.title_id, ;||			title.title, ;||			title.ret_price, ;||			ryltyspc.spec_no, ;||			ryltyspc.threshold, ;||			ryltyspc.discount AS discount,","ROYALTY3.FRX",F,4,"","Generates a detailed royalty statement for all authors of selected titles.","","***",11/6/2000
"Sales Rep Commission Specifics","Report Payables",T,"SREP_SEL.SPR","SELECT *, salesrepno as account_no ;||  FROM srcomspc ;|| WHERE spec_no > 0 ;||   <<select_str>> ;|| ORDER BY salesrepno ;|| INTO CURSOR commission","SRCOMSPC.FRX",F,5,"","","Used only when the toolbox print command is selected while viewing sales rep commission spec's.","RWL",6/14/2016
"Sales Tax - Canadian","Report Payables",T,"SALESTAX.SPR","SELECT orders.order_key, ;||	orders.order_type, ;||	orders.order_no, ;||	orders.invoice_no, ;||	orders.order_date, ;||	orders.subtotal, ; ||	orders.shipcharge, ;||	orders.taxable, ;||	orders.tax_ship, ;||	orders.s_tax_rate, ;||	orders.c_tax_rate, ;||	ord","STATETAX.FRX",T,5,"","Print a listing of sales tax due in a date range.","","***",2/27/2001
"Sales Tax - County","Report Payables",T,"SALESTAX.SPR","SELECT orders.order_key, ;||	orders.order_type, ;||	orders.order_no, ;||	orders.invoice_no, ;||	orders.order_date, ;||	orders.subtotal, ; ||	orders.shipcharge, ;||	orders.taxable, ;||	orders.tax_ship, ;||	orders.s_tax_rate, ;||	orders.c_tax_rate, ;||	ord","COUNTYTX.FRX",T,5,"","Print a listing of sales tax due in a date range.","","***",9/10/1997
"Sales Tax - State/Province","Report Payables",T,"SALESTAX.SPR","SELECT orders.order_key, ;||	orders.order_type, ;||	orders.order_no, ;||	orders.invoice_no, ;||	orders.order_date, ;||	orders.subtotal, ; ||	orders.shipcharge, ;||	orders.taxable, ;||	orders.tax_ship, ;||	orders.s_tax_rate, ;||	orders.c_tax_rate, ;||	ord","STATETAX.FRX",T,5,"","Print a listing of sales tax due in a date range.","","***",2/27/2001
"Sales Tax Charged - Canadian","Report Payables",T,"SALESTAX.SPR","SELECT orders.order_no, ;||	orders.invoice_no, ;||	orders.subtotal, ; ||	orders.shipcharge, ;||	orders.order_date, ;||	orders.order_type, ;||	orders.taxable, ;||	orders.tax_ship, ;||	orders.s_tax_rate, ;||	orders.c_tax_rate, ;||	contact.state_abbr, ;||	c","STATETAX.FRX",T,5,"","Print a listing of sales tax due in a date range.","","***",9/10/1997
"Sales Tax Charged - County","Report Payables",T,"SALESTAX.SPR","SELECT orders.order_no, ;||	orders.invoice_no, ;||	orders.subtotal, ; ||	orders.shipcharge, ;||	orders.order_date, ;||	orders.order_type, ;||	orders.taxable, ;||	orders.tax_ship, ;||	orders.s_tax_rate, ;||	orders.c_tax_rate, ;||	contact.state_abbr, ;||	c","COUNTYTX.FRX",T,5,"","Print a listing of sales tax due in a date range.","","***",9/10/1997
"Sales Tax Charged - State/Prov","Report Payables",T,"SALESTAX.SPR","SELECT orders.order_key, ;||	orders.order_no, ;||	orders.invoice_no, ;||	orders.subtotal, ; ||	orders.shipcharge, ;||	orders.order_date, ;||	orders.order_type, ;||	orders.taxable, ;||	orders.tax_ship, ;||	orders.s_tax_rate, ;||	orders.c_tax_rate, ;||	con","STATETAX.FRX",T,5,"","Print a listing of sales tax due in a date range.","","***",9/10/1997
"Sales by Title","Sales Reports",T,"ORDERSEL.SPR","SELECT ;||        title_id, ;||        title, ;||        ISBN, ;||        SUM(order_qty) AS order_qty, ;||        SUM(order_amt) AS order_amt, ;||        SUM(paid_qty) AS paid_qty, ;||        SUM(paid_amt) AS paid_amt ;||  FROM <<Report Title: Title Sale","SALESUMMARY.FRX",F,5,"","Reports sales for selected orders organized by title.","","***",1/6/2010
"Sales vs. Returns by Author","Sales Reports",T,"TITLESEL.SPR","SELECT IIF(ISNULL(last_name), space(35), IIF(EMPTY(last_name), UPPER(company), UPPER(last_name))) AS Sort3, ;||	sales.*, ;||	IIF(order_type = "C", order_qty, 0000000.00) AS orderqty, ;||	IIF(order_type = "R", order_qty, 0000000.00) AS returnqty, ;||	IIF(","SALESVSRETURNS.FRX",T,0,"","Lists total sales and returns for each title for the selected period.  Titles are organized by author.","","***",1/6/2010
"Sales vs. Returns by Supplier","Sales Reports",T,"TITLESEL.SPR","SELECT IIF(!EMPTY(Company), UPPER(company), UPPER(last_name)) AS Sort3, ;||	sales.*, ;||	IIF(order_type = "C", order_qty, 0000000.00) AS orderqty, ;||	IIF(order_type = "R", order_qty, 0000000.00) AS returnqty, ;||	IIF(order_type = "C", order_amt, 0000000","SALESVSRETURNS.FRX",T,0,"","Lists total sales and returns for each title for the selected period.  Titles are organized by supplier.","","***",1/6/2010
"Sample Fancy LIS Envelope","Print Invoice",T,"","SELECT * ;||  FROM contact ;||  WHERE contact_no = m.customerno ;||  INTO CURSOR curcntct","PAENVELOPE.FRX",F,5,"","Prints an envelope for the current invoice.  Change to a landscape printer setup!","This reports generates an individual invoice for the currently displayed customer order from the CUSTORDR screen.","***",12/11/2002
"Sample Fancy LIS Envelope w/ Window","Print Invoice",T,"","SELECT * ;||  FROM contact ;||  WHERE contact_no = m.customerno ;||  INTO CURSOR curcntct","PAENVELOPE2.FRX",F,5,"","Prints an envelope for the current invoice.  Change to a landscape printer setup!","This reports generates an individual invoice for the currently displayed customer order from the CUSTORDR screen.","***",12/11/2002
"Sample Fancy LIS Invoice","Print Invoice",T,"","	SELECT PADR(UPPER(ordritem.title), 72) AS sort2, ;||		orders.*, ;||		ordritem.*, ;||		orders.order_date AS reportdate ;||	 FROM orders ;||	   LEFT JOIN ordritem ON ordritem.order_key = orders.order_key ;||	 WHERE orders.order_key = m.order_key ;||	 ORDE","LISINVOICE.FRX",F,5,"balance, balance30, balance60, balance90, balance120","Generates an invoice for the currently displayed customer invoice.","This reports generates an individual invoice for the currently displayed customer order from the CUSTORDR screen.","***",10/2/2002
"Shipping Label","Print Invoice",T,"","	SELECT ;||		PADR(IIF(EMPTY(cust_po_no), "", "P.O.# ") + cust_po_no, 23) ;||			AS special, ;||		shipToAddr AS address, ;||		contact.* ;||	 FROM orders, contact ;||	 WHERE orders.order_type = "C" ;||	   AND orders.order_key = m.order_key ;||	   AND contact","LBL3X4X2.LBX",F,5,"order_bal","Generates shipping labels for the invoices in the print batch.","","***",6/24/1999
"Shipping Labels","Print Batch",T,"","	SELECT ;||		PADR(IIF(EMPTY(cust_po_no), "", "P.O.# ") + cust_po_no, 23) ;||			AS special, ;||		shipToAddr AS address, ;||		contact.* ;||	 FROM orders, contact ;||	 WHERE orders.order_type = "C" ; ||	   AND orders.order_key != 0 ;||	   AND orders.batch_no","LBL3X4X2.LBX",F,5,"order_bal","Generates shipping labels for the invoices in the print batch.","","***",12/4/2000
"Shipping Labels","Print Batch",F,"","	SELECT ;||		PADR(IIF(EMPTY(cust_po_no), "", "P.O.# ") + cust_po_no, 23) ;||			AS special, ;||		shipToAddr AS address, ;||		contact.* ;||	 FROM orders, contact ;||	 WHERE orders.order_type = "C" ; ||	   AND orders.order_key != 0 ;||	   AND orders.batch_no","CAMINO3X4X1.LBX",F,5,"order_bal","Generates shipping labels for the invoices in the print batch.","","***",4/3/2008
"Shipping Labels for Cartons","Print Batch",F,"","SELECT "" AS special, ;||		orders.order_key, ;||		orders.order_date, ;||		orders.shptocntct, ;||		orders.shipToAddr AS address, ;||		SUM(ordritem.quantity) AS quantity, ;||		CEILING(SUM(ordritem.quantity/title.carton_cnt)) AS CartnCount, ;||		repeatable.r","UNICEFSHIPPING.LBX",F,5,"","Prints shipping labels based on the carton count for the current batch of customer orders.","This query depends on the presense of the "Repeatable" table to facilitate the replication of records for each carton.","***",7/31/2006
"Shipping Labels for USPS Only","Print Batch",T,"","	SELECT ;||		PADR(IIF(EMPTY(cust_po_no), "", "P.O.# ") + cust_po_no, 23) ;||			AS special, ;||		orders.courier, ;||		shipToAddr AS address, ;||		contact.* ;||	 FROM orders, contact ;||	 WHERE orders.order_type = "C" ; ||	   AND orders.order_key != 0 ;||	","L3X4X1.LBX",F,5,"order_bal","Generates shipping labels for batched invoices shipped via a U.S. Postal Service.","","***",2/10/2003
"Sold Inventory History","Inventory Reports",T,"TITLESEL.SPR","SELECT title.title_id, ;||	title.title, ;||	title.isbn, ;||	title.supplierno, ;||  	inv_tran.transactno, ;||  	inv_tran.trans_date, ;||  	inv_tran.item_no, ;||  	inv_tran.condition, ;||  	inv_tran.inv_state, ;||  	IIF(EMPTY(inv_tran.condition), inv_tran.","INVHISTORY.FRX",F,4,"","Reports the inventory history of selected titles that are in a "Released" inventory state.","","***",4/28/2005
"Sold Inventory Status","Inventory Reports",T,"TITLESEL.SPR","SELECT title.title_id, ;||	title.title, ;||	title.isbn, ;||	title.supplierno, ;||	title.ret_price, ;||	title.OutOfPrint, ;||	0000000.00 + get_titlcost(title.title_id, title.consignmnt, title.ret_price) AS Cost, ;||  	inv_tran.transactno, ;||  	inv_tran.t","INVSTATUS.FRX",F,4,"","Reports the count of selected titles that are in a "Released" inventory state.","","***",4/28/2005
"Standing Orders Report","Print Standing Order",T,"","","STANDORD.FRX",F,4,"","","This report is necessary in order to process standing orders.  The Process Standing Orders routine uses the query for this report to select the orders to be processed.  DO NOT DELETE this report!","***",9/10/1997
"Statement of Unpaid Invoices","Report Receivables",T,"ORDERSEL.SPR","SELECT orders.*, ;||	SUM(IIF(ISNULL(ordercpt.order_paid), 000000.00, order_paid)) AS orderpaid, ;||	contact.company, ;||	contact.last_name, ;||	contact.first_name ;|| FROM orders LEFT JOIN ordercpt ON ordercpt.order_key = orders.order_key ;||   LEFT JOIN","UNPAIDIN.FRX",F,4,"balance, balance30, balance60, balance90, balance120","Generates billing statements listing unpaid invoices and their balances.","","***",9/10/1997
"Subscription Renewal Labels","Marketing Reports",T,"SUBSCSEL.SPR","SELECT DISTINCT ;||	" " AS special, ;||	PADR(get_addr(shptocntct), 210) AS address, ;||	orders.shptocntct, ;||	contact.company, ;||	contact.last_name, ;||	contact.zip_code ;||  FROM orders ;||    JOIN ordritem ON orders.order_key = ordritem.order_key ;||","LASERX3.LBX",F,5,"","Generates mailing labels for active subscribers.","This report has no query of its own.  It depends on the data being selected from the Process Subscriptions Screen from which it is called.","***",9/16/1999
"Subscription Renewal Labels no eMail","Marketing Reports",T,"SUBSCSEL.SPR","SELECT DISTINCT ;||	" " AS special, ;||	PADR(get_addr(shptocntct), 210) AS address, ;||	orders.shptocntct, ;||	contact.company, ;||	contact.last_name, ;||	contact.zip_code ;||  FROM orders ;||    JOIN ordritem ON orders.order_key = ordritem.order_key ;||","LASERX3.LBX",F,5,"","Generates mailing labels for active subscribers.","This report has no query of its own.  It depends on the data being selected from the Process Subscriptions Screen from which it is called.","***",8/8/2002
"Subscription Renewal Report","Marketing Reports",T,"SUBSCSEL.SPR","  SELECT ;||    UPPER(contact.company) AS sort1, ;||    UPPER(contact.last_name) AS sort2, ;||    UPPER(contact.first_name) AS sort3, ;||	orders.order_key, ;||	orders.order_no, ;||	orders.invoice_no, ;||	orders.order_date, ;||	orders.comment AS comment,","SUBSCRIP.FRX",F,4,"","Reports a list of active subscribers and some summary statistics.","","***",9/16/1999
"Supplier Account History","PO Status",T,"DATE_SEL.SPR","SELECT DISTINCT ldgrtran.transactno, ;||				ldgrtran.trans_date, ;||				ldgrtran.transevent, ;||				ldgrtran.trans_type, ;||				ldgrtran.account_no, ;||				ldgrtran.acct_type, ;||				ldgrtran.comment, ;||				ldgrtran.amount, ;||				ldgrtran.order_key, ;|","ACCOUNTS.FRX",F,5,"","Reports the account history for the supplier.","","***",1/1/1999
"Supplier Consignment Inventory","Report Payables",T,"TITLESEL.SPR","SELECT title.*, ;||	contact.last_name, ;||	contact.first_name, ;||	contact.company ;||  FROM title, contact ;||  WHERE consignmnt ;||	AND supplierno != 0 ;||	AND contact_no = supplierno ;||    <<SELECT_STR>> ;||  INTO CURSOR consignment ;||  ORDER BY com","CONSIGN2.FRX",F,4,"inv_array","Generates a statement for all or selected suppliers of consignment titles.","Works by selecting consignment titles.  Inventory statistics are returned in the array INV_ARRAY(2,6) by a call to function INVENTORY.","***",9/10/1997
"Supplier Sales by Cust. Code","Marketing Reports",T,"TITLESEL.SPR","SELECT ;||	company, ;||	last_name, ;||	first_name, ;||	title.title_id, ;||	title.title, ;||	title.supplierno, ;||	mrktcode.code, ;||	code.descript, ;||	SUM(IIF(order_type = "R", -quantity, quantity)) AS quantity, ;||	SUM(IIF(order_type = "R", -quantity,","SUPCCODE.FRX",T,5,"","Reports sales for selected titles sorted by customer codes.","Modified 6/26/200 to eliminate backordered and cancelled items.","***",6/26/2000
"Supplier Sales by Mrkt. Code","Marketing Reports",T,"TITLESEL.SPR","SELECT ;||	company, ;||	last_name, ;||	first_name, ;||	mrktcode.code, ;||	code.descript, ;||	title.title_id, ;||	title.title, ;||	title.supplierno, ;||	SUM(IIF(order_type = "R", -quantity, quantity)) AS quantity, ;||	SUM(IIF(order_type = "R", -quantity,","SUPCCODE.FRX",T,5,"","Reports sales for selected titles sorted by marketing codes.","Modified 6/26/200 to eliminate backordered and cancelled items.","***",6/26/2000
"Title Inventory History","Title Status",T,"DATE_SEL.SPR","SELECT title.title_id, ;||	title.title, ;||	title.isbn, ;||	title.supplierno, ;||  	inv_tran.transactno, ;||  	inv_tran.trans_date, ;||  	inv_tran.item_no, ;||  	inv_tran.condition, ;||  	inv_tran.inv_state, ;||  	inv_tran.quantity, ;||  	0000000 + IIF(E","INVHISTORY.FRX",F,4,"","Reports the inventory history of selected titles that are in an "available" inventory state.","","***",11/17/2004
"Title Inventory Status","Title Status",T,"DATE_SEL.SPR","SELECT title.title_id, ;||	title.title, ;||	title.isbn, ;||	title.supplierno, ;||	title.ret_price, ;||	title.OutOfPrint, ;||	get_titlcost(title.title_id, title.consignmnt, title.ret_price) AS Cost, ;||  	inv_tran.transactno, ;||  	inv_tran.trans_date, ;|","INVSTATUS.FRX",F,4,"","Reports the count of selected titles that are in an "available" inventory state.","","***",11/17/2004
"Title Listing by Call Number","Inventory Reports",T,"TITLESEL.SPR","SELECT title.*, ;||	PADR(MLINE(title, 1),50) AS sort_title ;|| FROM title ;|| WHERE !EMPTY(title_id) ;||  AND lupdate >= m.start_date ;||  AND lupdate <= m.end_date ;||  <<select_str>> ;|| ORDER BY class_id ;|| INTO CURSOR titlelst||","TITLECALLNO.FRX",F,3,"","Prints a brief listing of titles ordered by Title ID.","Lists selected titles.","***",12/31/2007
"Title Listing by ISBN","Inventory Reports",T,"TITLESEL.SPR","SELECT title.*, ;||	SUM(iif(isnull(inv_tran.quantity), 0000000.00, inv_tran.quantity)) AS on_hand ;|| FROM title LEFT JOIN inv_tran ;||   ON UPPER(inv_tran.title_id) == UPPER(title.title_id) ;||   AND EMPTY(inv_tran.condition) ;||   AND inv_tran.inv_stat","TITLE_ISBN.FRX",F,3,"","Prints a brief listing of titles ordered by Title ID.","Lists selected titles.","***",11/21/2002
"Title Listing by Title","Inventory Reports",T,"TITLESEL.SPR","SELECT title.*, ;||	PADR(MLINE(title, 1),50) AS sort_title ;|| FROM title ;|| WHERE UPPER(title_id) != SPACE(10) ;||  AND lupdate >= m.start_date ;||  AND lupdate <= m.end_date ;||  <<select_str>> ;|| ORDER BY sort_title, title_id ;|| INTO CURSOR titlels","TITLEID.FRX",F,3,"","Prints a brief listing of titles ordered by Title.","Lists selected titles.","***",9/10/1997
"Title Listing by Title ID","Inventory Reports",T,"TITLESEL.SPR","SELECT title.*, ;||	PADR(MLINE(title, 1),50) AS sort_title ;|| FROM title ;|| WHERE !EMPTY(title_id) ;||  AND lupdate >= m.start_date ;||  AND lupdate <= m.end_date ;||  <<select_str>> ;|| ORDER BY title_id ;|| INTO CURSOR titlelst||","TITLEID.FRX",F,3,"","Prints a brief listing of titles ordered by Title ID.","Lists selected titles.","***",9/10/1997
"Title Sales Summary by Customer 2","Sales Reports",T,"ORDERSEL.SPR","SELECT UPPER(contact.company) AS sort1, ;||	UPPER(contact.last_name) AS sort2, ;||	UPPER(contact.first_name) AS sort3, ;||	ordritem.title_id AS title_id, ;||	orders.order_key, ;||	orders.order_type, ;||	orders.customerno, ;||	orders.discount, ;||	orders.","TITLESALESUM.FRX",F,5,"","Reports the sales for selected customers by title.  Note:  Surcharges are NOT included.","11/25/02 -- This was adapted from the "Titles Sales for Customer" report to make the printout suitable to send to a customer.  Note:  Surcharges (i.e. shipping, taxes, and adjustments) are not included in these sales figures.","***",7/1/2010
"Title Sales by Customer","Sales Reports",T,"ORDERSEL.SPR","SELECT ;||        UPPER(ALLTRIM(contact.company)) + ;||        	UPPER(ALLTRIM(contact.last_name)) + ;||        	UPPER(ALLTRIM(contact.first_name)) AS Sort3, ;||		sales.*, ;||		contact.* ;||  FROM <<Report Title: Title Sales by Discount|<<select_str>>>> ;","TITLESALEBYCUSTOMER.FRX",T,5,"","Reports the title sales for selected invoices by customer.  Note:  Surcharges are NOT included.","11/25/02 -- This was adapted from the "Titles Sales for Customer" report to make the printout suitable to send to a customer.  Note:  Surcharges (i.e. shipping, taxes, and adjustments) are not included in these sales figures.","***",7/1/2010
"Title Sales by Discount","Sales Reports",T,"ORDERSEL.SPR","SELECT ;||        UPPER(LEFT(ordritem.title, 50)) AS Sort1, ;||        ordritem.title_id AS Sort2, ;||        1-(orders.discount+ordritem.discount)/100 AS rate, ;||        IIF(EMPTY(title.isbn), title.isbn13, title.isbn) AS ISBN, ;||        ordritem.quan","TITLESALESBYDISCOUNT.FRX",T,5,"","Reports the total sales for selected titles organized by discount.  This report is the basis for most other sales reports.","","***",1/28/2010
"Title Sales for Cust/Mrkt Codes","Sales Reports",T,"CODESEL.SPR","SELECT ;||        UPPER(ALLTRIM(contact.company)) + ;||        	UPPER(ALLTRIM(contact.last_name)) + ;||        	UPPER(ALLTRIM(contact.first_name)) AS Sort3, ;||		mrktcode.code AS code, ;||		PADR(code.descript, 50) AS descript, ;||		sales.*, ;||		contact.","TITLESALESBYCODE.FRX",F,5,"","Reports title sales for selected customer and/or marketing codes.","WARNING:  This query will replicate sales for each customer or marketing code assigned.","***",7/1/2010
"Titles Listing (Complete)","Inventory Reports",T,"TITLESEL.SPR","SELECT title.*, ;||	PADR(MLINE(title, 1),50) AS sort_title ;|| FROM title ;|| WHERE UPPER(title_id) != SPACE(10) ;||  AND lupdate >= m.start_date ;||  AND lupdate <= m.end_date ;||  <<select_str>> ;|| ORDER BY sort_title, title_id ;|| INTO CURSOR titlels","TITLES.FRX",F,3,"","Prints a complete profile for the selected titles.","Lists selected titles.","***",9/10/1997
"Titles Ordered","Customer History Rep",T,"DATE_SEL.SPR","SELECT orders.order_type, ;||	orders.order_no, ;||	orders.invoice_no, ;||	ordritem.item_no, ;||	ordritem.title_id, ;||  	ordritem.title, ;||  	IIF(order_type = "C", quantity, -quantity) AS quantity, ; ||  	ordritem.item_state ;|| FROM orders, ordritem ;|","CUSTITLE.FRX",F,3,"","Lists the titles ordered by the currently displayed customer.","Modified 6/26/200 to eliminate backordered and cancelled items.","***",6/26/2000
"Titles Sent to Reviewers","Marketing Reports",T,"TITLESEL.SPR","SELECT ;||	title.title, ;||  	title.title_id, ;||  	title.isbn, ;||  	title.ret_price,;||	orders.order_date, ;||	orders.shptocntct AS address,;||  	orders.comment, ;||  	orders.order_no, ;||  	orders.invoice_no, ;||	first_name, ;||	last_name, ;||	company","REVIEWRS.FRX",F,3,"","Lists reviewers by selected titles.","","***",9/10/1997
"Unapplied Brief List (DIT)","",T,"","","ACCTLIST.FRX",F,4,"","Generates a brief listing of all unapplied funds.","Lists the selected accounts with an account type of "A".  The report shows the detailed revenue transactions and the balance for each account.","***",10/14/1999
"Unapplied Brief List by Name","Report Receivables",T,"RECVABLS.SPR","SELECT ldgrtran.account_no, ;||				0000000.00 + unapplied2(account_no, 0, m.end_date) AS balance, ;||				MAX(ldgrtran.trans_date) AS as_of_date, ;||				contact.company, ;||				contact.LAST_NAME, ;||				contact.FIRST_NAME, ;||				contact.city, ;||				cont","ACCTLIST.FRX",F,4,"","Generates a brief listing of all unapplied funds.","Lists the selected accounts with an account type of "A".  The report shows the detailed revenue transactions and the balance for each account.","***",10/14/1999
"Unapplied Funds Detail","Report Receivables",T,"RECPTSEL.SPR","SELECT receipt.customerno AS account_no, ;||	receipt.recpt_date AS trans_date, ;||	ordercpt.unapplied AS amount, ;||	PADR(get_cust_po(ordercpt.order_key), 12) AS cust_po_no, ;||	PADR(getinvoice(ordercpt.order_key), 13) AS invoicestr, ;||	PADR(receipt.rec","UNAPPLDT.FRX",F,4,"","Generates a detaile report of all unapplied funds.","Lists the selected accounts with an account type of "A".  The report shows the detailed revenue transactions and the balance for each account.","***",1/7/2010
"Unpaid Invoices","Print Batch",T,"","	SELECT orders.*, ;||			ordritem.*, ;||			orders.order_date AS reportdate ;||	 FROM orders ;||	   LEFT JOIN ordritem ON ordritem.order_key = orders.order_key ;||	 WHERE orders.order_key != 0 ;||	   AND orders.order_type = "C";||	   AND orders.batch_no =","INVOICE.FRX",F,5,"balance, balance30, balance60, balance90, balance120","Prints only unpaid invoices that are in the current batch.","Modified 6/26/200 to eliminate backordered and cancelled items.","***",11/14/2006
"Unpaid Items","Report Receivables",T,"ORDERSEL.SPR","SELECT ordritem.item_no, ;||	ordritem.title_id, ;||	ordritem.title, ;||	title.isbn, ;||	orders.order_key, ;||	orders.order_no, ;||	orders.invoice_no, ;||	orders.order_date, ;||	orders.ship_date, ;||	orders.customerno, ;||	orders.terms, ;||	get_name(order","ITEMRCPTS.FRX",F,4,"","Presents a list of unpaid items for select orders.","","***",10/27/2005
"Unpaid Items by Title","Sales Reports",T,"ORDERSEL.SPR","SELECT * ;||  FROM <<Report Title: Title Sales by Discount|<<Select_str>>>> ;||  WHERE paid_qty != order_qty ;||  INTO CURSOR UnpaidItems||","ITEMSALE.FRX",F,5,"","Reports items where the quantity paid for is less than the ordered quantity.","","***",1/6/2010
"Unshipped Items","Inventory Reports",T,"","SELECT orders.order_type, ;||	orders.order_key, ;||	orders.order_no, ;||	orders.invoice_no, ;||	orders.order_date, ;||	orders.status, ;||	orders.subtotal, ;||	orders.discount as odiscount, ;||	orders.total, ;||	ordritem.item_no, ;||	ordritem.title_id, ;|","UNSHIPPED.FRX",T,0,"","Reports on items that have no item state even though the order has been shipped or closed.","","***",3/12/2008
"Warehouse Inventory","Inventory Reports",T,"TITLESEL.SPR","SELECT title.title_id, ;||		title.title, ;||		title.consignmnt, ;||		inv_tran.location, ;||		title.ret_price, ;||		get_titlcost(title.title_id, title.consignmnt, title.ret_price) AS cost, ;||  		SUM(inv_tran.quantity) AS qty_left, ;||  		contact.company,","CONSSTAT.FRX",F,4,"","Reports the location, count and value (cost) of available books in warehouse locations.","Was "Missing Inventory".","***",6/2/2005
"Title Sales by Discount 2","Sales Reports",T,"TITLESEL.SPR","SELECT ;||        UPPER(LEFT(ordritem.title, 50)) AS Sort1, ;||        ordritem.title_id AS Sort2, ;||        1-(orders.discount+ordritem.discount)/100 AS rate, ;||        IIF(EMPTY(title.isbn), title.isbn13, title.isbn) AS ISBN, ;||        ordritem.quan","TITLESALESBYDISCOUNT.FRX",T,5,"","Reports the total sales for selected titles organized by discount.  This report is the basis for most other sales reports.","","RWL",7/6/2012
"Invoices by Selection","Sales Reports",T,"ORDERSEL.SPR","SELECT PADR(UPPER(ordritem.title), 70) AS title2, ;||	orders.*, ;||	ordritem.*, ;||	title.isbn, ;||	title.isbn13, ;||	orders.ship_date AS reportdate ;|| FROM orders ;||   LEFT JOIN ordritem ON ordritem.order_key = orders.order_key ;||   LEFT JOIN title O","INVOICE.FRX",F,5,"balance, balance30, balance60, balance90, balance120","Prints invoices for the current batch of customer invoices.","The report form INVOICE.FRX generates the invoices either for an individual order or for the selected batch of shipments.","RWL",7/16/2012
